{
  "$schema":"https://json-schema.org/draft/2020-12/schema","$id":"https://cloverapps.ai/schemas/launch-studio/0.1.0/restoration-receipt.schema.json","title":"Launch Session restoration receipt","type":"object","additionalProperties":false,
  "required":["documentType","schemaVersion","restorationId","exportId","sessionId","restoredAt","sourceManifestHash","restoredManifestHash","sourceStateHash","restoredStateHash","sourceEventStreamHash","restoredEventStreamHash","identityEqual","cleanDestination","privateDataAccessed","externalEffects","synthetic","consequentialAuthorityGranted","receiptHash"],
  "properties":{"documentType":{"const":"clover-launch-session-restoration-receipt"},"schemaVersion":{"const":"0.1.0"},"restorationId":{"$ref":"common.schema.json#/$defs/id"},"exportId":{"$ref":"common.schema.json#/$defs/id"},"sessionId":{"$ref":"common.schema.json#/$defs/id"},"restoredAt":{"$ref":"common.schema.json#/$defs/timestamp"},"sourceManifestHash":{"$ref":"common.schema.json#/$defs/hash"},"restoredManifestHash":{"$ref":"common.schema.json#/$defs/hash"},"sourceStateHash":{"$ref":"common.schema.json#/$defs/hash"},"restoredStateHash":{"$ref":"common.schema.json#/$defs/hash"},"sourceEventStreamHash":{"$ref":"common.schema.json#/$defs/hash"},"restoredEventStreamHash":{"$ref":"common.schema.json#/$defs/hash"},"identityEqual":{"const":true},"cleanDestination":{"const":true},"privateDataAccessed":{"const":false},"externalEffects":{"$ref":"common.schema.json#/$defs/externalEffects"},"synthetic":{"type":"boolean"},"consequentialAuthorityGranted":{"const":false},"receiptHash":{"$ref":"common.schema.json#/$defs/hash"}}
}
