{"cleanDestination":true,"consequentialAuthorityGranted":false,"documentType":"clover-launch-session-restoration-receipt","exportId":"launch_export_synthetic_001","externalEffects":[],"identityEqual":true,"privateDataAccessed":false,"receiptHash":"cb5d2ce8f5d3e8f725377d88e5a435ec4d39deab0026e61e867b23b2ea2adddd","restorationId":"launch_restoration_synthetic_001","restoredAt":"2026-08-23T12:21:00.000Z","restoredEventStreamHash":"4f6bdc17a46ababb808142811a3df46b620d1836402fc4c65ef7fad7e4d0db6b","restoredManifestHash":"6084d691ec00bd8e0549ff949a4c8c7498adf73386cd60f9a6f07529a33c04a3","restoredStateHash":"c1f9e2dda33576eb1c1031df6d717f417c453615bf30df8afc70c608200ba51e","schemaVersion":"0.1.0","sessionId":"launch_session_synthetic_owner_001","sourceEventStreamHash":"4f6bdc17a46ababb808142811a3df46b620d1836402fc4c65ef7fad7e4d0db6b","sourceManifestHash":"6084d691ec00bd8e0549ff949a4c8c7498adf73386cd60f9a6f07529a33c04a3","sourceStateHash":"c1f9e2dda33576eb1c1031df6d717f417c453615bf30df8afc70c608200ba51e","synthetic":true}
